{
  "evidence_id": "EVD-G2-REQUIREMENTS-REVIEW",
  "change_id": "CHG-2026-003",
  "type": "review",
  "uri": "changes/CHG-2026-003-private-gate-role-injection/requirements.md",
  "sha256": "36c0f5ad0fe04b433d48c05efa27791e2290d32fc461d61e22a17d5548089006",
  "produced_at": "2026-07-14T15:14:25Z",
  "producer": "Justin",
  "tool": {
    "name": "manual-review",
    "version": "1.0"
  },
  "requirements": [
    "REQ-ROLE-MAP-001",
    "REQ-GATE-RESOLVE-001",
    "REQ-PRIVATE-ACTOR-001",
    "REQ-GATE-WORKFLOW-001",
    "REQ-STATE-REMEDIATION-001",
    "NFR-PERF-003",
    "SEC-IDENTITY-002",
    "SEC-PRIVACY-002",
    "OPS-REL-003"
  ],
  "result": "pass"
}
