{
  "evidence_id": "EVD-G1-PROPOSAL-REVIEW",
  "change_id": "CHG-2026-001",
  "type": "review",
  "uri": "changes/CHG-2026-001-manifest-ci-gate/proposal.md",
  "sha256": "b1158569e07958632de9343d14ffe9433387d094ad3a8aa718043f4f87cc7a71",
  "produced_at": "2026-07-12T15:20:25.2222586Z",
  "producer": "Justin",
  "tool": {
    "name": "manual-review",
    "version": "1.0"
  },
  "requirements": [],
  "result": "pass"
}
