{
  "evidence_id": "EVD-DESIGN-ADDENDUM-002-REVIEW",
  "change_id": "CHG-2026-003",
  "type": "review",
  "uri": "changes/CHG-2026-003-private-gate-role-injection/design-addendum-002.md",
  "sha256": "dbdb1959d84db12e2e70e085a8004264e9eba06aa63375195bf4823b06526efc",
  "produced_at": "2026-07-15T04:09:25Z",
  "producer": "Justin",
  "tool": {
    "name": "manual-review",
    "version": "1.0"
  },
  "requirements": [
    "REQ-GATE-WORKFLOW-001",
    "REQ-STATE-REMEDIATION-001",
    "SEC-PRIVACY-002",
    "OPS-REL-003"
  ],
  "result": "pass"
}
