{
  "evidence_id": "EVD-G2-REQUIREMENTS-REVIEW",
  "change_id": "CHG-2026-001",
  "type": "review",
  "uri": "changes/CHG-2026-001-manifest-ci-gate/requirements.md",
  "sha256": "91c45596752b96284a9775dcbf391ea64cbd155ae3d542cdc234fe1fc45fc4fd",
  "produced_at": "2026-07-12T15:40:15.7272980Z",
  "producer": "Justin",
  "tool": {
    "name": "manual-review",
    "version": "1.0"
  },
  "requirements": [
    "REQ-MANIFEST-001",
    "REQ-IDENTITY-PRIVACY-001",
    "NFR-PERF-001",
    "SEC-APP-001",
    "OPS-REL-001"
  ],
  "result": "pass"
}
