{
  "evidence_id": "EVD-G1-PROTECTED-WORKFLOW-VERIFICATION",
  "change_id": "CHG-2026-003",
  "type": "security_scan",
  "uri": "changes/CHG-2026-003-private-gate-role-injection/evidence/GATE-G1-RUN-29354763421.md",
  "sha256": "7203d5aea8d4ed0c29b65623d68975ab9d07ffe3593bf2707f3a3bb8b3d41e14",
  "produced_at": "2026-07-14T17:46:47Z",
  "producer": "GitHub Actions / Codex verifier",
  "tool": {
    "name": "SDD Gate Approval and offline privacy verifier",
    "version": "e151976b023065ea28d0da30d9c9e5da8011755e"
  },
  "requirements": [
    "REQ-GATE-WORKFLOW-001",
    "SEC-IDENTITY-002",
    "SEC-PRIVACY-002",
    "OPS-REL-003"
  ],
  "result": "pass"
}
