{
  "evidence_id": "EVD-G4-IMPLEMENTATION-READINESS",
  "change_id": "CHG-2026-003",
  "type": "review",
  "uri": "changes/CHG-2026-003-private-gate-role-injection/g4-readiness.md",
  "sha256": "b6181db18dcf21bbcec842dd0f18f2ee6384aebac471af212ddb88064b850824",
  "produced_at": "2026-07-14T16:08:44Z",
  "producer": "Justin",
  "tool": {
    "name": "manual-review",
    "version": "1.0"
  },
  "requirements": [
    "REQ-ROLE-MAP-001",
    "REQ-GATE-RESOLVE-001",
    "REQ-PRIVATE-ACTOR-001",
    "REQ-GATE-WORKFLOW-001",
    "REQ-STATE-REMEDIATION-001",
    "NFR-PERF-003",
    "SEC-IDENTITY-002",
    "SEC-PRIVACY-002",
    "OPS-REL-003"
  ],
  "result": "pass"
}
